{
  "slug": "software-architect",
  "title": "Software Architect",
  "summary": "Le rôle d'architecte logiciel : responsabilités, prise de décision, largeur technique (styles, APIs, réseaux, données, ops, sécurité) et compétences de collaboration. Fidèle à la roadmap.sh, pensé pour progresser de développeur à architecte.",
  "kind": "TRACK",
  "position": 7,
  "phases": [
    { "title": "Comprendre les bases", "position": 0 },
    { "title": "Responsabilités de l'architecte", "position": 1 },
    { "title": "Compétences clés", "position": 2 },
    { "title": "Socle technique", "position": 3 },
    { "title": "Styles d'architecture", "position": 4 },
    { "title": "Intégration & réseau", "position": 5 },
    { "title": "Opérations & sécurité", "position": 6 },
    { "title": "Données", "position": 7 },
    { "title": "Processus, outils & entreprise", "position": 8 }
  ],
  "nodes": [
    {
      "slug": "what-is-architecture",
      "title": "Qu'est-ce que l'architecture logicielle",
      "summary": "Les décisions structurantes et difficiles à changer.",
      "phase": "Comprendre les bases",
      "importance": "CORE",
      "estimatedMinutes": 45,
      "position": 0
    },
    {
      "slug": "what-is-architect",
      "title": "Qu'est-ce qu'un architecte logiciel",
      "summary": "Rôle, posture et différence avec le lead développeur.",
      "phase": "Comprendre les bases",
      "importance": "CORE",
      "estimatedMinutes": 45,
      "position": 1
    },
    {
      "slug": "levels-of-architecture",
      "title": "Niveaux d'architecture",
      "summary": "Application, solution, entreprise.",
      "phase": "Comprendre les bases",
      "importance": "CORE",
      "estimatedMinutes": 45,
      "position": 2
    },
    {
      "slug": "tech-decisions",
      "title": "Décisions techniques & d'architecture",
      "summary": "Choisir, arbitrer, différer et tracer les décisions (ADR).",
      "phase": "Responsabilités de l'architecte",
      "importance": "CORE",
      "estimatedMinutes": 55,
      "position": 0
    },
    {
      "slug": "requirements-elicitation",
      "title": "Recueil des exigences",
      "summary": "Extraire besoins fonctionnels et attributs de qualité.",
      "phase": "Responsabilités de l'architecte",
      "importance": "CORE",
      "estimatedMinutes": 50,
      "position": 1
    },
    {
      "slug": "documentation",
      "title": "Documentation d'architecture",
      "summary": "C4, vues, ADR : documenter juste assez.",
      "phase": "Responsabilités de l'architecte",
      "importance": "CORE",
      "estimatedMinutes": 50,
      "position": 2
    },
    {
      "slug": "enforcing-standards",
      "title": "Faire respecter les standards",
      "summary": "Guardrails, fitness functions, revues.",
      "phase": "Responsabilités de l'architecte",
      "importance": "RECOMMENDED",
      "estimatedMinutes": 45,
      "position": 3
    },
    {
      "slug": "collaborate-coach",
      "title": "Collaborer, consulter & coacher",
      "summary": "L'architecte au service des équipes, pas au-dessus.",
      "phase": "Responsabilités de l'architecte",
      "importance": "RECOMMENDED",
      "estimatedMinutes": 45,
      "position": 4
    },
    {
      "slug": "decision-making",
      "title": "Prise de décision & simplification",
      "summary": "Arbitrer sous incertitude, simplifier, garder les mains dans le code.",
      "phase": "Compétences clés",
      "importance": "CORE",
      "estimatedMinutes": 50,
      "position": 0
    },
    {
      "slug": "communication-estimation",
      "title": "Communication, estimation & influence",
      "summary": "Expliquer, estimer, équilibrer, convaincre.",
      "phase": "Compétences clés",
      "importance": "RECOMMENDED",
      "estimatedMinutes": 45,
      "position": 1
    },
    {
      "slug": "programming-languages",
      "title": "Panorama des langages",
      "summary": "JVM, Python/Ruby/Go, JS/TS, .NET : quand quoi.",
      "phase": "Socle technique",
      "importance": "RECOMMENDED",
      "estimatedMinutes": 50,
      "position": 0
    },
    {
      "slug": "patterns-principles",
      "title": "Patterns & principes de conception",
      "summary": "SOLID, DDD, TDD, ACID/CAP, réactif : le socle de décision.",
      "phase": "Socle technique",
      "importance": "CORE",
      "estimatedMinutes": 60,
      "position": 1
    },
    {
      "slug": "architectural-styles",
      "title": "Styles d'architecture",
      "summary": "Couches, client-serveur, microservices, serverless, SOA, distribué.",
      "phase": "Styles d'architecture",
      "importance": "CORE",
      "estimatedMinutes": 60,
      "position": 0
    },
    {
      "slug": "frontend-architecture",
      "title": "Architecture front-end",
      "summary": "SPA/SSR/SSG, micro-frontends, standards du web.",
      "phase": "Styles d'architecture",
      "importance": "RECOMMENDED",
      "estimatedMinutes": 45,
      "position": 1
    },
    {
      "slug": "apis-integrations",
      "title": "APIs & intégrations",
      "summary": "REST, gRPC, GraphQL, SOAP/ESB : styles d'intégration.",
      "phase": "Intégration & réseau",
      "importance": "CORE",
      "estimatedMinutes": 55,
      "position": 0
    },
    {
      "slug": "networks",
      "title": "Réseaux",
      "summary": "OSI/TCP-IP, HTTP(S), proxies, firewalls.",
      "phase": "Intégration & réseau",
      "importance": "RECOMMENDED",
      "estimatedMinutes": 50,
      "position": 1
    },
    {
      "slug": "messaging",
      "title": "Messaging & files",
      "summary": "Files, event-driven, découplage temporel.",
      "phase": "Intégration & réseau",
      "importance": "RECOMMENDED",
      "estimatedMinutes": 45,
      "position": 2
    },
    {
      "slug": "operations-devops",
      "title": "Opérations & DevOps",
      "summary": "IaC, conteneurs, CI/CD, cloud, service mesh, cloud patterns.",
      "phase": "Opérations & sécurité",
      "importance": "CORE",
      "estimatedMinutes": 55,
      "position": 0
    },
    {
      "slug": "security",
      "title": "Sécurité",
      "summary": "Hachage, PKI, OWASP, stratégies d'authentification.",
      "phase": "Opérations & sécurité",
      "importance": "CORE",
      "estimatedMinutes": 55,
      "position": 1
    },
    {
      "slug": "working-with-data",
      "title": "Travailler avec les données",
      "summary": "SQL/NoSQL, ETL/entrepôts, big data, analytics.",
      "phase": "Données",
      "importance": "CORE",
      "estimatedMinutes": 55,
      "position": 0
    },
    {
      "slug": "tools",
      "title": "Outils de l'architecte",
      "summary": "UML, C4, TOGAF/BABOK, gestion & collaboration.",
      "phase": "Processus, outils & entreprise",
      "importance": "RECOMMENDED",
      "estimatedMinutes": 40,
      "position": 0
    },
    {
      "slug": "management-methodologies",
      "title": "Méthodes & gestion",
      "summary": "Agile/Scrum/Kanban/SAFe, certifications de gestion.",
      "phase": "Processus, outils & entreprise",
      "importance": "RECOMMENDED",
      "estimatedMinutes": 45,
      "position": 1
    },
    {
      "slug": "enterprise-software",
      "title": "Logiciels d'entreprise",
      "summary": "ERP, CRM, BPM : SAP, Salesforce, Dynamics.",
      "phase": "Processus, outils & entreprise",
      "importance": "OPTIONAL",
      "estimatedMinutes": 35,
      "position": 2
    }
  ],
  "edges": [
    { "source": "what-is-architecture", "target": "what-is-architect", "kind": "PREREQ" },
    { "source": "what-is-architect", "target": "levels-of-architecture", "kind": "PREREQ" },
    { "source": "levels-of-architecture", "target": "tech-decisions", "kind": "PREREQ" },
    { "source": "tech-decisions", "target": "requirements-elicitation", "kind": "PREREQ" },
    { "source": "requirements-elicitation", "target": "documentation", "kind": "PREREQ" },
    { "source": "documentation", "target": "enforcing-standards", "kind": "PREREQ" },
    { "source": "enforcing-standards", "target": "collaborate-coach", "kind": "PREREQ" },
    { "source": "tech-decisions", "target": "decision-making", "kind": "PREREQ" },
    { "source": "decision-making", "target": "communication-estimation", "kind": "PREREQ" },
    { "source": "decision-making", "target": "patterns-principles", "kind": "PREREQ" },
    { "source": "programming-languages", "target": "patterns-principles", "kind": "PREREQ" },
    { "source": "patterns-principles", "target": "architectural-styles", "kind": "PREREQ" },
    { "source": "architectural-styles", "target": "frontend-architecture", "kind": "PREREQ" },
    { "source": "architectural-styles", "target": "apis-integrations", "kind": "PREREQ" },
    { "source": "apis-integrations", "target": "networks", "kind": "PREREQ" },
    { "source": "apis-integrations", "target": "messaging", "kind": "PREREQ" },
    { "source": "architectural-styles", "target": "operations-devops", "kind": "PREREQ" },
    { "source": "operations-devops", "target": "security", "kind": "PREREQ" },
    { "source": "architectural-styles", "target": "working-with-data", "kind": "PREREQ" },
    { "source": "documentation", "target": "tools", "kind": "PREREQ" },
    { "source": "collaborate-coach", "target": "management-methodologies", "kind": "PREREQ" },
    { "source": "management-methodologies", "target": "enterprise-software", "kind": "PREREQ" }
  ]
}
